{
  "artifact_type": "generated_eval_review_queue",
  "artifact_id": "GERQ-4951A48DF49449B3",
  "generated_eval_ids": [
    "GEC-4B9A9F9E26A54D4C",
    "GEC-A712DD0D3D73ABCC"
  ],
  "total_candidates": 2,
  "high_priority_candidates": [
    "GEC-4B9A9F9E26A54D4C"
  ],
  "created_at": "2026-04-19T00:05:00Z"
}
